text,label
"China market opens, Iowa caucuses, Alphabet earnings: 3 things to watch for on Monday https://t.co/nZDp3smBbK",2
"Consumer Next Shoe To Drop As Wall Street Ignores Data ""Decelerating Hard"" https://t.co/yMxGcUbAt5",2
"Coronavirus update: China toll skyrockets, but markets calm amid government cash infusion",2
"Dow futures up 5 points, or less than 0.1%; S&P 500 down 2 points, or 0.1%",2
Dow Jones News: Microsoft Reveals Next Xbox; Apple Avoids Tariffs,2
Dow Jones Today: A Trade-Induced Hangover,2
Europe has the longest trading hours among major stock markets—some two hours longer than the U.S. https://t.co/OtvJdYEqoR,2
General Announcement::AIMS APAC REIT secures 12-year Master Lease with its largest tenant ... #SingaporeExchange… https://t.co/SEvz80TbIN,2
"General Announcement::Announcement by Associated Company, First Sponsor Group Limited #CityDevelopments #Stock… https://t.co/M0Z9Zi6VI6",2
General Announcement::ENTRY INTO A SUPPLEMENTAL DEED IN RELATION TO DC1 #SingaporeExchange #Stock #MarketScreener… https://t.co/FbOamR7PDT,2
General Announcement::Immediate Report - updated rating report (Midroog) #SingaporeExchange #Stock #MarketScreener… https://t.co/fAUcb1cjQV,2
General Announcement::LOAN FACILITY OBTAINED BY KEPPEL PACIFIC OAK US REIT #SingaporeExchange #Stock… https://t.co/MGjSiYEQK6,2
General Announcement::Melco Resorts Finance Announces Proposed Senior Notes Offering #SingaporeExchange #Stock… https://t.co/8tIoYSk4oM,2
General Announcement::Monthly Valuation of Assets and Utilisation of Cash #SingaporeExchange #Stock #MarketScreener… https://t.co/ceKi3BXPZ4,2
General Announcement::Sasseur REIT will be included in FTSE EPRA Nareit Global Emerging In... #SingaporeExchange… https://t.co/hYBpfL3Wkw,2
"General Announcement::SIIC Environment to Build 3,800 tonnes per day Waste Treatment Proje... #SIIC #Stock… https://t.co/OzKMWezAnp",2
Here's what happened to the stock market on Monday,2
Here's what happened to the stock market on Tuesday,2
"India's NAFED tenders to purchase 100,000 tonnes corn",2
"Japan Exchange : Feb. 10, 2020 OSE Deletion of Component Issues for the TSE Mothers Index ... #JapanExchange… https://t.co/9qNtBBch4v",2
Leveraged ETF Decays - Update. Get more updates here: https://t.co/WIdIm2w4Wv #business #finance #trading,2
London Stock Exchange : ALLERGAN PLC #LondonStockExchange #Stock #MarketScreener https://t.co/TJKXaJyPaQ https://t.co/fbl4KXRy9F,2
London Stock Exchange : Cleansing Notice #LondonStockExchange #Stock #MarketScreener https://t.co/RHuUGxiLJs https://t.co/oSk2zYY3ns,2
London Stock Exchange : Disclosure Table #LondonStockExchange #Stock #MarketScreener https://t.co/lyWcd2pDeg https://t.co/636ZdNiJ9c,2
London Stock Exchange : Early Redemption #LondonStockExchange #Stock #MarketScreener https://t.co/6cFHJ3Ev4H https://t.co/F4jHwOXNUq,2
London Stock Exchange : Form 8.3 -  #LondonStockExchange #Stock #MarketScreener https://t.co/T6RyzZ5NYM https://t.co/luERmBW1OG,2
London Stock Exchange : Form 8.3 - Replacement of ALLERGAN PLC #LondonStockExchange #Stock #MarketScreener… https://t.co/uGV2vlER0j,2
Market Scales New High: Top-Ranked Growth ETFs to Buy,2
Mid-Day Market Update: Tallgrass Energy Jumps Following Acquisition News; Proteostasis Therapeutics Shares Plummet,2
Mid-Morning Market Update: Markets Edge Higher; Jabil Beats Q1 Expectations,2
Mid-Morning Market Update: Markets Mixed; Adobe Earnings Beat Estimates,2
"Morgan Stanley says forecasting just the next two months, let alone 2020, is hard right now",2
"Mutual Fund Misfires of the Market - February 06, 2020",2
"Mutual Fund Misfires of the Market - November 25, 2019",2
NASDAQ : Debtor distribution data - Nykredit Realkredit A/S #NASDAQ #Stock #MarketScreener https://t.co/SMj5BFtWla https://t.co/Hu7raCpRPc,2
NASDAQ : Oplysning om kommende ændring i Møns Banks ledelse. #NASDAQ #Stock #MarketScreener https://t.co/qlR9lUawdD https://t.co/AnDoa08djJ,2
"NASDAQ : Quarterly Statistical Bulletin Vol 8, No 2, June 2019 - Contents and Narratives #NASDAQ #Stock… https://t.co/g9bUP5eu2R",2
Nasdaq Composite down 0.1%; S&P 500 virtually flat,2
Nasdaq Private Market Sets New Annual Transaction Record in 2019 - StreetInsider.com,2
"Netflix must add ad tier or lose millions of users, Needham says https://t.co/t5UrBmVB5Q via @business https://t.co/zyU9wT1Rhg",2
News Highlights : Top Global Markets News of the Day #NewsHighlights #economy #MarketScreener… https://t.co/gQINsmgO3f,2
News Highlights : Top Global Markets News of the Day #NewsHighlights #economy #MarketScreener… https://t.co/p9YIUK150y,2
NYSE Opening Bell : @Generac (NYSE: $GNRC) celebrates their 10th anniversary of listing https://t.co/Mnq8o5gzRd,2
On the hour https://t.co/UjTgLR5wPY,2
On the hour https://t.co/wrsG5l495t,2
Premarket London: EasyJet Profit in Line; Hammerson Fire Sale Continues,2
"S&P 500 earnings upside in 2020 will ‘primarily depend’ on U.S.-China trade deal, says JP Morgan https://t.co/CZBvuUZvJW",2
S&P 500 Vs. Commodity Markets: Relative Valuation. https://t.co/RoLVSOYei0 #markets #finance #trading,2
"S&P, Dow fall as Nasdaq inches up",2
"Shares gain, but doubts linger on U.S.-China deal, oil rises",2
Some odd divergences in the past two weeks as most asset classes except stocks are reversing recent gains https://t.co/0XJwxOyhBA,2
"Stock market live updates: Dow down 180, coronavirus names fall, Uber best day ever",2
"Stock Market Live Updates: Stocks end little changed, lashed by Brexit and US-China trade - Yahoo Finance",2
"Stock market news: November 18, 2019",2
Stock Market News: Uber Hits the Gas; Pinterest Paints a Pretty Picture,2
"Stock Market Update: Asia closes mixed, Europe trades lower",2
Stock Market Update: Averages Still Mixed,2
Stock Market Update: Early Levels,2
"Stock Market Update: Energy remains weak, while mega-cap tech remains strong",2
Stock Market Update: Futures little changed amid news of a limited trade agreement,2
Stock Market Update: Futures Update,2
"Stock Market Update: Retail stocks extend losses, health care sector gains",2
Stock Market Update: S&P 500 returns to flat line,2
"Stock Market Update: Stock market opens little changed, energy stocks remain weak",2
"Stock Market Update: Stock market slows down, jobs report beats expectations",2
"Stock Market Update: Stock market trades mixed; Home Depot, Kohl's weigh on retail space",2
Stock Market Update: Wall Street closes little changed after Phase One deal reached,2
"Stock-index futures hold gains after retail sales, import prices data",2
Stocks eke out early gains but retail names drag,2
Stocks finish mixed as Nasdaq logs third consecutive all-time closing high,2
"Stocks indexes edge higher for the day, lower for the week https://t.co/BRAUhY2mLn",2
Stocks mixed on choppy trading day https://t.co/UTpt8KyZzi by @heidi_chung https://t.co/FAsMkTHEbL,2
Stocks on Wall Street ended Thursday's session little changed as investors avoided making risky bets amid a lack of… https://t.co/0l38qIDkoG,2
Stocks rose slightly on Friday but headed for their first weekly decline amid uncertainties around the U.S.-China t… https://t.co/sGXQfU6Okt,2
Stocks were little changed at the close despite the news of impeachment articles being drafted and a looming deadli… https://t.co/3N0hpQ4I4b,2
Sugar Traders Hold Tight: India’s Set to Roil Markets Again,2
"Tech Retakes Leadership Role With Chips And Cloud Names Moving Higher, I See A Pattern - Seeking Alpha",2
The index has served as a yardstick for Hong Kong’s rise and its rebounds from various crises https://t.co/VwB9brLhAp,2
The latest on U.S. markets https://t.co/Er61EMyHsj https://t.co/4Jzex6liAG,2
"The latest pre-open #analysis of #news, #data driving the #market https://t.co/2JWcYQceMg #PageOne $SPY $DIA $QQQ… https://t.co/X96M6stFge",2
The Time for Canada’s Stock Market to Shine May Be in 2020,2
This week's #economic data releases & forecasts https://t.co/nWoqf7UPiu #AdvIntlTradeInGoods #AdvRetailInventories… https://t.co/bqHJvUPTHE,2
Trade momentum rose in September for the first time in four months https://t.co/dsCS1fltgF,2
Trade momentum rose in September for the first time in four months https://t.co/mdVAsk2sAd,2
Trading in China ETFs Soars as Trump Upends Tariff Optimism,2
Trading of Own Shares for Treasury Month: January 2020  #Stock #MarketScreener https://t.co/tW02ga4gHQ https://t.co/OjXKmfOETD,2
"U.S. equities edged higher, while European and Asian stocks slipped, as investors sought to gauge the economic hit... https://t.co/GimDRAOMRy",2
U.S. stock futures hold modest gains after housing reports,2
"U.S. stocks end higher Friday, but S&P 500 suffers weekly decline https://t.co/0BZLR3sOoF",2
"US indices are having the best year since 2013, but large cap active funds are poised to see the worst year since 2016: BofA",2
"Utilities 'the most underappreciated sector,' T. Rowe Price analyst says",2
"Wall Street ends near flat after U.S., China announce trade deal",2
Wall Street hovers near record levels; Boeing drags on Dow,2
"Week ahead: Black Friday, Federal Reserve’s Powell https://t.co/gGzgz0fEPi",2
Weekly market update : The waiting game continues on trade #Weeklymarketupdate #marketscreener #MarketScreener… https://t.co/77sw5i2a8t,2
"Voters in key 2020 election states are growing increasingly pessimistic about the economy, as the coronavirus crisi… https://t.co/5hJJPXZ9mB",0
"""I accept this award on behalf of Ethiopians and Eritreans.""

Ethiopian Prime Minister Abiy Ahmed receives the… https://t.co/QQCGKVPtFq",2
"""It Was A Coup. Period"": Tulsi Gabbard Slams US 'Interference' In Bolivia https://t.co/3onatHQ80T",2
"""It's impossible to say, under any serious economic model, under which party's manifesto the economy would do bette… https://t.co/M2QJOYgqvL",2
"""I am happy with him, I really think he's caught up,"" Trump said of Fed Chair Jerome Powell at the White House… https://t.co/8jASKLBath",2
"""This Brexit failure was founded on lies and hypocrisy""

These 4 friends behind @ByDonkeys have crowdfunded hundred… https://t.co/vuJouFUSya",2
.@realDonaldTrump has repeatedly touted his friendship with China's President Xi. @JimCramer says @BernieSanders wo… https://t.co/ixnYugXsRX,2
"‘Chill Is Real,’ Trudeau Envoy to China Says of Huawei Feud",2
‘Unicorns and rainbows!’ Kellyanne Conway shrugs off Bloomberg’s candidacy https://t.co/iKDhlGygzZ,2
"“It was a great opportunity to say thank you to the president.”

Australia’s PM Scott Morrison comments on his call… https://t.co/o1tPma45v6",2
“President Trump is facing a process which is unprecedented for its unfairness.” Sam Dewey,2
“The Democrats are getting hit and slammed on Impeachment. It is getting less and less popular by the day.” @kilmeade @foxandfriends,2
“The investigation isn’t going to end” https://t.co/HMbZzmpBQ0,2
“The support for Impeachment is not there. I think the Democrats will have to come up with a new game plan.” @jasoninthehouse @FoxNews,2
A new proposal in Congress is looking to resurrect an old tradition: mailing Social Security statements to your hom… https://t.co/Sx8wmqma1j,2
"Alberto Fernández was sworn in as Argentina’s new president on Tuesday, marking a historic return to power for the… https://t.co/NDEKx0Wy2l",2
Alexandria Ocasio-Cortez says she plans to oppose House Speaker Nancy Pelosi's drug pricing bill https://t.co/JRz5PJzGU2,2
Alpha Dog Putin Shows Meeker Side With Erdogan,2
An open letter to President Trump 3 years after the election,2
"Angela Merkel's government announces a new ""limitless"" aid program for small companies as part of an effort to supp… https://t.co/pOUgvxI83v",2
"As senators prepare to vote on whether to call witnesses like John Bolton, the New York Times has more details of t... https://t.co/PkbmI4tI8f",2
"Astrology is cool again. So what will happen with Brexit, and who will win the 2020 US election? A prominent New Yo… https://t.co/Hqm5nw1d77",2
"Azerbaijan's first snap parliamentary elections 'lacked genuine competition and choice,' international monitors say https://t.co/l4dHpIed1E",2
Azeri Snap Elections Condemned by Monitors for Vote 'Violations',2
"Bernie Sanders and Pete Buttigieg are asking for a partial retabulation of Iowa caucus results, citing 'widespread… https://t.co/z6BFj6ecyn",2
Bernie Sanders Builds Big Primary Machine to Win Prized California,2
"Bernie Sanders continues to challenge Joe Biden for the lead spot among Democratic voters nationally, according to... https://t.co/oG49GKDPSc",2
Bernie Sanders has unveiled a plan to expand broadband internet access as part of a push to boost the economy and r… https://t.co/ioo9NksE4f,2
Betsy DeVos: This Memo Will Better Protect Student Loan Borrowers,2
Biden Adviser Raises Questions About Iowa Caucus Over App  Problems,2
Biden Campaign Says It Will Push Ahead Regardless of New Hampshire Results,2
"BJP Issues Whip To Its MPs Asking Them To Be Present In Lok Sabha, Rajya Sabha On Tuesday",2
Bloomberg Gets Backing of Former Navy Secretary Ousted by Trump,2
Bloomberg Unveils Extreme Gun Control Plan https://t.co/1MYugJ8NQF,2
Bloomberg’s entry into presidential race raises ethical issues for his news service https://t.co/uAdHDWYlH9,2
Boris Johnson Cancels 2020 Tax Cut for Businesses: U.K. Votes,2
Boris Johnson postpones plans to cut corporate taxes,2
Boris Johnson to remain in hospital for coronavirus tests https://t.co/yb71eAmWCJ,2
Boris Johnson vows no tax hikes in Tory manifesto https://t.co/yRiMKCH4Kx,2
Boris Johnson wins overwhelming victory in UK,2
Boris Johnson’s New Priorities See the U.K. Boycott Davos,2
Boris Johnson's New Priorities See the U.K. Boycott Davos,2
Brazil minister says it's 'impossible' to put value on Eletrobras privatization https://t.co/XW6C3vlrys https://t.co/CUcOenJhTx,2
Brexit Bulletin: An Unpalletable Truth,2
"Brexit is rattling Europe's market for carbon allowances, and the U.K. election may push traders off the fence no m… https://t.co/xKXLK2DGmM",2
British politicians are clueless on what the public thinks about trade https://t.co/ZDb7sH34Af,2
Brussels Edition: Truce Offerings to Trump,2
Buttigieg Faces Tough Battle to Repeat Iowa Feat in Later States,2
California Won't Buy From Automakers Who Sided With Trump,2
Canada's New Health Minister's Thoughts On Cannabis: What You Should Know,2
"Canadian ministers meet with CN Rail, union as strike looms",2
Check out the week's most compelling political images https://t.co/zSsEt9ApVb,2
"China attacks US at G20 as the world’s biggest source of instability- CNBC

https://t.co/pelfsYwKo7",2
"CNN: Trump Is Leader Of ""Destructive Cult""; Using ""Mind Control"" On Americans https://t.co/jT5f1YL3bP",2
Comey Admits Being ‘Overconfident’ in Approving Trump Probe,2
Congress is asking Airbnb to provide information about hosts that list short-term rentals on the site who don’t com… https://t.co/4XbG6HxVHy,2
Congress Leaders Move Supreme Court Against Amended Citizenship Act,2
"Congress Mulls Reviving Tax Breaks Prized by ADM, Tesla, GM",2
Conservatives promise ‘world class’ public services https://t.co/tPF3DYeTzY,2
Consumer watchdog now downplaying a major Obama-era tool https://t.co/cvSWyzRjRa by @ewolffmann https://t.co/a5izdbTdPC,2
Democrats Getting 'Cold Feet' As Impeachment Support Evaporates https://t.co/EXIydIMZFS,2
Democrats need to realize that impeaching Trump may not accomplish anything at all https://t.co/3wm2QztpnQ,2
Democrat's New Taxes Wouldn't Hit Just Billionaires,2
Democrats Share Attack Lines in New Hampshire: Campaign Update,2
"Donald Trump likes to boast that he has unwavering Republican support, but that backing is softer than he suggests https://t.co/pGEjBhAyaX",2
Donald Trump on Social Security: Everything You Need to Know,2
El Salvador president's strong-arm tactics spark outrage https://t.co/hdr7gv0VwR,2
Elizabeth Warren releases doctor's note describing good health as voters weigh age of contenders https://t.co/dBR1MTNndt,2
Erik Prince Held Secret Talks in Caracas With Maduro’s No. 2,2
European diplomats have a message for Donald Trump: Bullying tactics won't win support for your Iran policy https://t.co/Sqv08TNymv,2
"Federal pension fund says bill banning China investment is discriminatory
https://t.co/lu8hGlQOng https://t.co/zEyhfoysF9",2
Finance Minister Begins Pre-Budget Consultations Starting Monday,2
"For the first time in a decade, the US has sent its most senior Pentagon official to Taiwan, in a reflection of Was… https://t.co/jbyM6Wtt9j",2
Former Ecuadorian President Rafael Correa goes on trial on charges of campaign finance fraud and accepting millions… https://t.co/7RozGXYGMx,2
Former Goldman Sachs CEO pushes back on Warren attacks -CNBC,2
Former Trump advisor John Bolton accuses White House of locking him out of his Twitter account https://t.co/YqiocDdTOH,2
"French labor unions call for a new day of protests, seeking to force President Emmanuel Macron to either sweeten hi… https://t.co/DCRPnEQTEY",2
Friday Humor: Democratic Candidates Clash Over Most Effective Plan To Destroy Economy https://t.co/PY6FPtrzbi,2
GERMAN SPD BACKS DEMANDS FOR TALKS TO STAY IN MERKEL COALITION,2
German union calls for pre-Christmas Amazon strike,2
Germany sees 1.5 billion euro annual take from new financial transaction tax https://t.co/iPthaL90l2 https://t.co/RG3XG3w21M,2
Germany’s ruling Christian Democrats call for restrictions on Huawei participating in country's 5G network  https://t.co/SnLAwUkfOA,2
"Giuliani Giving Ukraine Data to Justice Department, Barr Says",2
Gove Rules Out Scottish Independence Referendum: U.K. Politics,2
Government Launches Portal For Subsidy Scheme Under PMAY,2
Government Moves Bill In Lok Sabha To Appoint Unified Regulator For IFSCs,2
Governments across Asia are pushing back against unwanted rubbish from overseas that has accumulated within their b… https://t.co/XpcZWX1Zvy,2
Guinea-Bissau’s current leader was eliminated from the country’s presidential election after two former prime minis… https://t.co/W5EAleiG8s,2
"Gundlach, who nailed Trump's 2016 election, says he'll win again 'if economy holds' https://t.co/7VpbVtA6Jf by… https://t.co/5c0lQ7uJwZ",2
Here’s the latest on the 2020 presidential race and what to watch today https://t.co/U5CyPJT9wk,2
Here’s the latest on the 2020 presidential race and what to watch today 🇺🇸 https://t.co/wTckp0G5yX,2
Here’s what bugs Democratic presidential candidate Michael Bennet about the front-runners https://t.co/WbeSOQXEmh b… https://t.co/I1wGD5GQBN,2
Here's the breakdown of Sen. Bernie Sanders estimated $60 trillion tax plan. https://t.co/9V6UzmgEqL https://t.co/QohPU0ObdX,2
Here's the latest on the 2020 presidential race and what to watch today https://t.co/bqcNCYePt3,2
Here's where we are in the impeachment process and what comes next https://t.co/5xb30d9RIE https://t.co/Q6rrrDV2Xz,2
Hindu nationalists see Ayodhya victory as just the start https://t.co/ioPLTg6aAc,2
Hong Kong’s Pro-Democracy Candidates Poised to Win Majority https://t.co/eqVNozsPw0,2
Hong Kong’s pro-democracy candidates won an overwhelming victory in district council elections on Sunday after mont… https://t.co/x6TIyihqT9,2
Hong Kong's leader has insisted that escalating violence would not force her administration to yield to protester d… https://t.co/jmPHQjCdtc,2
Horowitz: FBI Should Have Pumped The Brakes On Surveillance Of Trump Campaign Aide https://t.co/1dbsrboUxf,2
How Trump's trade war is hurting swing states,2
How Trump's trade war is hurting swing states https://t.co/cwagyBCUsZ by @rickjnewman https://t.co/sanXxpy2gT,2
How will the Democratic primaries shift the election? Listen to @rickjnewman and @alexisTVNews discuss on the lates... https://t.co/S9v1dUSTvE,2
"'I’m [Russia's] main opposition leader not because I banned everyone else from being one, but because it’s scary to… https://t.co/ZvTDBnpcMn",2
Impeachment Probe Turns to Trump Ally at Heart of Ukraine Storm,2
Impeachment Theater Offers Americans Glimpse Of The Unseen-Unelected Who Actually Rule Over Us https://t.co/YaAnzODftL,2
"Incompetence, not ideology, is the worst thing about this election https://t.co/fOEQ6ytIRQ",2
Investors 'are really excited about the Donald Trump presidency continuing': top strategist,2
Ireland Brings New Twist to Populism,2
It's the first election in the U.S. to enable any resident to vote by phone https://t.co/uzzKuoaxCu,2
Jeremy Corbyn has announced he would take 'a neutral stance' in a second Brexit referendum if Labour won the genera… https://t.co/3GoAfSyPoU,2
Jeremy Corbyn is a controversial leader even in his own party. Here's why https://t.co/iXYhL6ruuN,2
Jeremy Corbyn says he would be ‘neutral’ in a second Brexit poll https://t.co/ohBKNqUPwZ,2
"Jim Messina: The re-election of Donald Trump would pose an existential threat to the US and the world
https://t.co/AsNHP7ndbt",2
Joe Biden claims he said 'facts' not 'fat' to Iowa voter: Listen to the tape yourself https://t.co/GullZ5Y8cn,2
Joe Biden's campaign is determined to fight past Tuesday's New Hampshire primary https://t.co/atUGC75MkS,2
"Joe Biden's tax plan is refreshingly moderate, says @karlbykarlsmith, especially when compared with those of his ri… https://t.co/WoGXdbgZc3",2
John Bercow reveals Boris Johnson’s tennis trick https://t.co/tNmicgcYVJ,2
John Major gives his backing to Tory rebel candidates https://t.co/H8v7Zdr0lR,2
"Johnson promises Brexit on Jan. 31, trade deal in 2020",2
Johnson Races to Pass U.K. Terror Law Before Next Convict Freed,2
Johnson seeks votes in whirlwind tour of Britain https://t.co/bf5zh0o594,2
Johnson’s manifesto demands voters take a lot on trust https://t.co/CR3aYBCVy4,2
"Kelly Craft, U.S. ambassador to the UN, said the Security Council is united in its alarm over repeated missile test… https://t.co/cy49hcyJxx",2
"Lam to Update Xi, China Officials on Protests: Hong Kong Update",2
"LATEST: House Democrats plan a vote next week on the U.S.-Mexico-Canada free-trade agreement.

Pelosi says the amen… https://t.co/AA8kt2AgrD",2
Lighthizer Scores a Trifecta of Wins for Trump's Trade Agenda,2
LIVE: Senate impeachment trial continues with debate over allowing witnesses https://t.co/hr2ky3aRFy,2
Marco Rubio expects the Senate to pass at least one more coronavirus relief bill https://t.co/0ZsedODFPg,2
Merkel Calls for Reversal of CDU's 'Unforgivable' Far-Right Deal,2
Merkel Party Leader Gets Unanimous Backing for Thuringia Plan,2
Michael Bloomberg has officially entered the Democratic race for president. https://t.co/L2azcIm5tl,2
Michael Bloomberg makes it official: ‘I’m running for president’ https://t.co/w1iKZiD1Dp,2
Michael Gove warns the logistics industry to prepare for strict border controls between Britain and the EU after Br… https://t.co/CE4krhmkBO,2
Mid-Southern Bancorp appoints Robert W. Derossett as CFO,2
Mike Bloomberg is running for president — his policies will impact these big industries https://t.co/RtwU4Px1cN,2
"Mitch McConnell says voting on the USMCA won't happen next week. 

""That will have to come up, in all likelihood, r… https://t.co/rjqIpJPU3i",2
"Naive Brazil to Rethink Relations With U.S., Bolsonaro Ally Says",2
New Hampshire Debate Marks New Phase in Democratic Battle,2
New Twitter Account Drives Fresh Talk of Pompeo Senate Run,2
"New York AG used pulled fraud claims to score political points, Exxon says",2
"Obviously, I am not a communist,' @BernieSanders said, adding that Trump 'maybe doesn't know the difference."" https://t.co/kaI5i9Wflu",2
Officials at Ukraine's U.S. embassy got word that the U.S. had frozen military aid in July—but it would be weeks be… https://t.co/FefZ6ISQGo,2
Partisan finger-pointing in Congress threatens to poison the debate when lawmakers try to find another emergency bo… https://t.co/QW0zRqu5Aj,2
Pelosi criticizes Trump's prayer breakfast comments as 'without class' - POLITICO,2
Pete Buttigieg is raking in more money from the entertainment industry than any of his rival Democratic presidentia… https://t.co/tkfGFxHkiQ,2
Pete Buttigieg now No. 1 in Iowa polls,2
Plaid Cymru promises ‘green jobs revolution’ for Wales https://t.co/gvCquqXb6q,2
"President Donald Trump assumes economic growth above 3% this year in his annual budget proposal, exceeding mainstre… https://t.co/UvzzuACRmO",2
President Donald Trump continued his attacks on ousted U.S. Ambassador to Ukraine Marie Yovanovich and other witnes… https://t.co/iS70j1CODY,2
President Donald Trump said that he’ll stand by his man Mike Pence in the 2020 campaign https://t.co/3P6kMk7O32,2
President Donald Trump's $4.8 trillion budget for the upcoming fiscal year proposes billions more in funding for de… https://t.co/H8nA9oT4IB,2
President Trump expected to release $4.8 trillion 2021 budget,2
"President Xi Jinping calls China’s sprawling belt and road initiative the ""project of the century,"" but many challe… https://t.co/gEHXcRX16J",2
Prime Minister of Hungary : The opportunity to reach agreement on the EU budget will certa...… https://t.co/jWlhC4WRmp,2
Prosecutors said former Trump campaign aide Rick Gates deserves leniency for his “extraordinary assistance” probing… https://t.co/ftzEvrQzdv,2
"Rabobank on Democratic primary: ""Oddly for the ‘party of the workers’, two of its 18 candidates for president are n… https://t.co/gEWb4uXfsS",2
Rebel in tweed battles to defend his seat against former party https://t.co/I16hXgX5c4,2
"Rep. Alcee Hastings, who faces House ethics probe, paid his girlfriend more than his chief of staff https://t.co/LFGBJPrAtS",2
Rep. Jerry Nadler leaves Trump impeachment trial to be with his wife as she battles cancer https://t.co/oHh8E2STU7,2
Republicans & Democrats Agree: Give Vast Snooping Powers To The US Government https://t.co/qzg817g3Wb,2
