text,label
Highlight: 'The Fittest Man on Earth' @mathewfras talks investing: https://t.co/tBc8uSnphc,2
"Highlight: 'When it comes to private investing or investing in general, the earlier a company is, the higher the ri... https://t.co/MHh1YT2DWr",2
"Hillary Tweets ""No One Is Above the Law"" Then Refuses To Accept Lawsuit Against Her https://t.co/UsNIiPt2fs",2
Hollywood Knows It Has a Big Carbon Problem on Set,2
Homebuilders aren't keeping up with millennials https://t.co/xj0m1YhP4A,2
Hong Kong Banks Give Extra Days Leave to Staff Amid Virus Outbreak,2
Hong Kong Banks Give Extra Days Leave to Staff Amid Virus Outbreak,2
"Hong Kong bill, more earnings, Powell speech: 3 things to watch for Monday https://t.co/MAz7bG2lCv",2
Hong Kong’s protests: Inside the PolyU siege https://t.co/uV3oO7kAGw,2
HORNBACH : USDA Releases 2018 Annual Pesticide Data Program Summary #HORNBACH #Stock #MarketScreener… https://t.co/ErsPNvvazi,2
"Hot #BlackFriday tip: ""Put things in your cart and leave them there."" https://t.co/awiDWdUSvD",2
How ‘green hydrogen’ could make a reality of ‘green steel’ https://t.co/BLFp8uIog1,2
How a chat with Chuck Schwab inspired a bold S&P 500 call https://t.co/DqWD1kFHBJ,2
How a Supreme Court case could change how cities treat the homeless https://t.co/hIujtrIKUX via @BW,2
"How are technological advances causing a boom in renewable energy? Find out in our new infographic, ""The Power Shif… https://t.co/gVDgEE6ArY",2
How Beyoncé and Mariah Carey made Airbnb a luxury brand https://t.co/1reTl4zElG,2
"How can businesses lead on climate action? (Sponsored by TBD Media)
https://t.co/kH12YgUHYe https://t.co/CnUhlXIPMe",2
How cheap-chic retailer Target has morphed into a model for how to avoid the retail apocalypse https://t.co/67FNXAUvYh,2
How clean hydrogen could make the steel industry less dependent on coal https://t.co/Cz0qP3FKWI,2
How conservation investment could be a lifeline for endangered species https://t.co/GnpuFvx9ir,2
How did investors react to Tesla's Cybertruck announcement? They bought GM and Ford shares: https://t.co/LTq5CnNU4K,2
How do “no loan” college financial-aid packages work? Here is what students need to know https://t.co/y0LgFFPkDo,2
How do investors calculate opportunity costs? Enrico Cacciatore (@Ejcacciatore) of @VoyaInvestments joins Nasdaq Ch… https://t.co/ScAss7zlzI,2
How does one avoid the real estate value trap?  https://t.co/9aYYgpJtSm,2
How financial advisors can strive for a higher standard when recommending life insurance https://t.co/91N7LqMh1A,2
How Germany's universal health-care system compares to the United States https://t.co/OFTD46m79m,2
"How investing in #sustainableinfra in developing countries can foster economic and climate resilience? 

Blog by… https://t.co/27lz691wBf",2
How is a bank's GSIB score calculated https://t.co/m7AIabn6U0,2
How is Salesforce $CRM putting its Tableau and Mulesoft acquisitions to work? #DF19 https://t.co/7AyperfESO,2
How much do you make? Salary disclosures could boost what you earn https://t.co/fE37bjxtlm by @denitsa_tsekova https://t.co/75fs8dg8fI,2
How much garbage do you generate in a day?  Read our new #IMFBlog to see which countries top the list.... https://t.co/yy3JxiZyGs,2
How Switzerland Could Find Itself Labeled a Currency Manipulator,2
How the USMCA Affects U.S. Steelmakers and Auto Manufacturers,2
How this company makes meat alternatives out of air,2
How to Celebrate Valentine's Day on a Budget,2
How to Find Cheap Buy-Ranked Stocks Trading Under $10 - Nasdaq,2
How To Live A Climate-Friendly Life,2
How to Make a Killing During the Biggest Housing Boom in History,2
How to Recover When You Don't Stick to Your Retirement Plan,2
How to Save Money on These 3 Holidays in 2020,2
How to trade Ulta $ULTA - no makeup tutorial needed  https://t.co/0WkngwEVCQ,2
How Trader Sentiment On Streaming Stocks Has Changed Since Disney+ Launch,2
HR Confidential: I fired her. Then she revealed all of the office's sordid sex-and-drugs stories. (via @CNBCMakeIt) https://t.co/Pkyk6k5nkg,2
https://t.co/575AH1YRkF,2
https://t.co/oJxNPEUpWq,2
Huge lines at Hong Kong polling stations for local elections after months of #HongKongProtests. All sides are urgin… https://t.co/IiOd5lGMhw,2
Human Rights Watch says a palm-oil producer is polluting the environment and threatening the health of its workers… https://t.co/hMQCOrsjdY,2
"Hypothecation: Meaning, Risks, and Examples",2
I can't imagine why this artwork was shadow banned .... who did this?? https://t.co/ZktS3MykQz,2
"I don’t blame them for refusing to cook a Wagyu steak well done. In fact, I applaud that. If you don’t like it then… https://t.co/SOTqpEwBSh",2
I gave up my smartphone for a week and lived with a phone that only places calls — and I hated it.… https://t.co/5nB4kYMDOW,2
"I See A Window For Fast Money Trading On The Long Side Today, Here's The Plan. https://t.co/2i2b3py70P #trading #economy #stockmarket",2
I was not pleased with the way that Navy Seal Eddie Gallagher’s trial was handled by the Navy. He was treated very… https://t.co/bFwiFKQi9e,2
Iberchem Group verzeichnet Rekordjahr mit Übernahme von zwei Aromenfirmen und Umsatzwachstum von 19%,2
"If you hit the $237 million Powerball jackpot, this is your tax bill. https://t.co/F35lmfwIYq",2
"If you win the $285 million Mega Millions jackpot, here's what to do first to protect your windfall https://t.co/hoqEe4pBVr",2
"If your iPhone updated to the latest iOS, you now have the option of gender-neutral emojis ⚧️ https://t.co/iDVPlXRdjl",2
"If you're flush with cash, here's where you should (and shouldn't) live. https://t.co/z0Zp7pbkui https://t.co/NM8pKXGUZY",2
"If you're worried, instead of ringing the doomsday bells, start getting ready  https://t.co/nB605rLdj6",2
Il Governo etiope e il gruppo Alibaba siglano accordi per la creazione di un polo eWTP in Etiopia,2
Illegal Tender podcast: What it was like to befriend convicted socialite scammer Anna Delvey,2
Illinois’s Legalized Pot Sales Debut Beats All States Except One,2
Important note about this performance:  Sean entered the contest late and didn't start trading until almost have th… https://t.co/MgK7mfz7TK,2
"In a world where air conditioning is intensifying global warming, how do we stay cool? The answer could be somethin… https://t.co/dYTan9dAFw",2
"In one corner: a 32-year-old investment firm worth $221.8 billion. In the other, a 29-year-old pop star worth $360… https://t.co/jQyqPCeBPJ",2
"In this market, gaining 12.8% for the 12 months makes you the top stock-fund manager https://t.co/aVQ9SiucK7",2
Income Lab Ideas: Distribution Cut - Don't Panic. Get more updates here: https://t.co/RO4gkAN22a #trading #finance #economy,2
Increase Your Credit Score With This 1 Trick,2
Indonesia Eyes Empty Islands for Quarantine Hub Amid Virus Fears,2
Indonesia’s Jokowi Warns of Economic Calamity From Forest Fires,2
Inside CannTrust: Whistleblower reveals new video of alleged illegal grow room https://t.co/c8LjKtDW3X by… https://t.co/zed9ztYFuq,2
Insider Weekends: John Malone Purchases $75 Million Of Discovery. Get more updates here: https://t.co/LViwlOMqpM… https://t.co/Z5a4sKLcRI,2
Instadollars: 10 Celebrities Who Earn The Most Money With Instagram,2
"Instead of Universal Basic Income, Try Universal Basic Stakeholding",2
Interactive Brokers : Offering Fractional Share Trading Broker broadening access to more e... #InteractiveBrokers… https://t.co/aGHDxwa2Po,2
"Invest in Art or Stocks? Keynes Has an Answer (Well, Sort Of)",2
Investors Become Richer By Rs 1.81 Lakh Crore As Stocks Zoom,2
Investors Get 2 New ESG ETFs for 2020,2
Investors look to emerging markets amid trade fight,2
"Investors often make poor, emotional decisions based on dips in their portfolio, @danariely says. Here is his advic… https://t.co/hkTqX14vKw",2
IRA Taxes in 2020: What You Need to Know,2
Iran joins Russia and China in joint naval exercises beginning Friday https://t.co/YEzWswZJTh,2
Is cable news keeping the average American out of the stock market? @JimCramer weighs in: https://t.co/IP6xHN4Fz2 https://t.co/qL77cZ4RfB,2
"Is the plague making a comeback? Actually, it never went away https://t.co/uPSNRLdQKh",2
Is this Wuhan's new hospital,2
Israelis Hurt in Jerusalem Car Ramming Attack,2
Istanbul mulls Eurobond issue after banks balk at funding the city https://t.co/ZoZC6W91EV,2
"It’s a big week for the U.S. consumer, and not just because of the annual retail extravaganza of Black Friday https://t.co/1vRRvGmpg4",2
"It’s official: ""Joker"" is the first $1 billion R-rated movie. https://t.co/GXKQDVZhg2 https://t.co/ujB4YqgCn0",2
It’s T-Shirt Weather in Antarctica as Temperature Breaks Record,2
"Italy is the first country in the world to introduce mandatory climate change lessons in schools. 

@JohnFollain re… https://t.co/kuB7J49O7K",2
"It's a good time to buy property in London, says Christie's https://t.co/pI1JBFZPh7",2
"It's been a year of buzzkills for the legal cannabis industry. Here are this year's biggest offenders (and yes, Can… https://t.co/eGnsYfczFC",2
It's Getting Harder to Make Money Flipping Houses,2
It's important to have a mix of long-term and short-term investments. Knowing what to expect from each will help yo… https://t.co/Qn7rC3I2MH,2
"It's not just 'orange man bad.' For Dems, 'white man bad,' too - American Thinker",2
"It's OK to Take Pens From the Office, But Not Pasta Salad",2
"It's okay Greg, your insurance will cover it.",2
It's rate decision day in Israel – here's what to expect https://t.co/FE4SB0Q1fQ https://t.co/6aRqBv5rZl,2
Ivory Coast police clash with protesters over coronavirus test centre #economy #MarketScreener… https://t.co/OS8ODHvy79,2
Japan Finds 41 More Virus Cases on Cruise Ship,2
Japan’s Justice Minister Says No Need to Ban All Cruise Ships Due to Virus Fears,2
Jeff Bezos: $160 billion vs. $95.3B Bill Gates: $97B vs. $42B Warren Buffett: $88B vs. $35B https://t.co/yKlnLDbcQB,2
Jet industry's grand masters fight to a draw in Dubai #Stock #MarketScreener https://t.co/xRSWD6hsIM https://t.co/0GWXM4muhL,2
JetBlue is trying to hold onto its quirky culture while succeeding at the balancing act all airlines face: keeping… https://t.co/gPAw2Uj7co,2
JP Morgan has a bargain stock pick to play the holiday shopping season and a completed trade deal,2
"'Jumanji' Sequel With Dwayne Johnson, Kevin Hart Tops Box Office",2
Jumia: continental drift https://t.co/ww84pxa3RN,2
JUST IN: 2 people are in custody after authorities fired shots at an intruder vehicle outside Trump's Mar-a-Lago cl... https://t.co/g6VMUioO1A,2
"JUST IN: New York City has its first confirmed case of coronavirus in the borough Queens, the New York Daily News r... https://t.co/sdvVn5iNmg",2
Just published: front page of the Financial Times international edition Saturday November 23 https://t.co/BsEyxVQF8U https://t.co/aENnx0odBu,2
JUST RELEASED: Our newest #EconFocus looks at our fear of #recession. Could our expectations about the economy be s... https://t.co/DMi9fgdNBx,2
Justices seem to favor insurers' Obamacare claims for $12B https://t.co/xUiexlNf66 https://t.co/h2SNcp0plY,2
"Karvy Case: SAT Asks SEBI To Hear Axis Bank’s Plea, Pass Order Within 15 Days",2
Key events next week - healthcare,2
Key Supplier Negotiation Strategies for Successful Procurement| Request a FREE Demo from SpendEdge for More Insights,2
"Kobe Bryant could have become better at investing, says 76ers' Michael Rubin https://t.co/iCQPiX8hGn",2
Korian s’associe à Omedys pour développer le premier réseau de téléconsultation de proximité à l’échelle nationale,2
Kylie Jenner Is Keeping Up With the Billionaires,2
Kylie Jenner Just Got Even Richer,2
L.A.’s First Step in Housing the Homeless Is Counting Them,2
Lachlan Murdoch buys mansion for record $150M,2
Last week our Community Investment Council toured #Greensboro to look at how communities better prepare students fo… https://t.co/PTxS453ACn,2
"Last week, we hosted the 7th IMF Statistical Forum on Measuring the Informal Economy. Watch the events and read the… https://t.co/dBL2OpHfw4",2
Latest Bridge Collapse Shows Italy Can’t Get a Grip on Its Roads,2
"Leaders from BaubleBar, b8ta, and Leap share what they’ve learned about the move from digital commerce to storefron… https://t.co/vOrWsEW7lY",2
Leaked Chinese documents show how mass surveillance system flags Uighurs for detention camps https://t.co/IWP7hj4bVW,2
"Leave with this --&gt;  It is only failure if you stay down after the fall.  Get back up, dust yourself off and start anew.",2
Leaving Walmart after paying off several layaway balances. Thanks to all of my children for pitching as well. You m… https://t.co/v1L7o1hfy0,2
Life on a Cruise Ship Struck by the Coronavirus,2
"Like our Premarket posts? Come check us out at https://t.co/yChRCoaR8v

No bullshit live breaking news and rumors w… https://t.co/rirBmfyRrj",2
LISTEN NOW: A former Boeing employee speaks out on 737 Max safety concerns — this story and more on the Squawk Pod… https://t.co/fdsIVgVqSj,2
"LISTEN NOW: Merger Monday, Bloomberg’s 2020 presidential run and holiday travel congestion — these stories and more… https://t.co/dxj43amFIa",2
"LISTEN NOW: The holiday week begins with some $60 billion in formally announced M&A involving LVMH, Charles Schwab,… https://t.co/k3VjEDHvbZ",2
"LISTEN NOW: Uber revealed disturbing new data on sexual assaults, a blowout jobs report, and gaming's big future wi… https://t.co/3xW1BILn8r",2
"Listen to our latest #RegionalView, where Regional Economist Alex Marre discusses economic conditions at a conferen… https://t.co/kPM1I5vMfE",2
Listen to today's Yahoo Finance Daily presented by @VerizonBusiness: https://t.co/MT5k7AWvdU https://t.co/pgYmd3l0V9,2
"LIVE NOW: Ming Tsai (@mingtsai), chef and restaurant owner, joins Yahoo Finance. Watch on https://t.co/xpAujlllJF! https://t.co/82g26MW8oo",2
Living near main road ‘could raise lung cancer risk by 10 per cent’ https://t.co/308PyOMuT4,2
London stalling... https://t.co/8iINzcpNd8,2
London Stock Exchange : Audited Results for the Year Ending 31 August 2019 #LondonStockExchange #Stock... https://t.co/ENK5wCbMac,2
London Stock Exchange : Public policy and social science cross disciplinary divide #LondonStockExchange #Stock... https://t.co/3IVIYQwlPc,2
London Underground Faces Bakerloo Line Strike This Month,2
London Underground Faces February Bakerloo Line Strike Action,2
"Londong calling: The property arm of the world's largest auction house, Christie's, says buy in London as a rebound… https://t.co/2nyebHlXUL",2
"LOOK: A landslide in the Italian village of Comune Pieve di Teco left 22 families cut off on Saturday. Debris, dam… https://t.co/0lzOV8hNPz",2
"LOOK: Anti-government protesters burn tires to block roads in Basra, as demonstrations against poor services and sh… https://t.co/9pCSrWQTem",2
LOOK: Hong Kong officials count votes in the city's 1st district council elections since the #HongKongProtests bega… https://t.co/mSm0OmYXkW,2
"Looking for a new gig in 2020?

Of the top 100 best places to work, 31 are tech companies, but the top 5 will surpr… https://t.co/gpEzpX53tQ",2
Looking For Last-Minute Tax Loss Harvesting Ideas? Here’s One.,2
Lucille Brobbey: Black women should be able to walk into the office with pride and wear their afro or braids withou… https://t.co/GT7lbRdDMG,2
Luke Edward Hall's thoughtful presents for interiors lovers https://t.co/VAjt00YGkm,2
"Macro Review/Preview, free this weekend, out in a bit, enjoy our time with family this weekend everyone!",2
Maduro abraza el capitalismo y los emigrantes regresan al pas,2
Maduro Embraces Capitalism and Venezuelan Emigres Are Returning,2
"Make $125,000 in 2019? Here's How Much Income Tax You Could Pay.",2
"Make the Most of Your Retirement with These Top-Ranked Mutual Funds - February 07, 2020",2
Malaysia Plans to Vaccinate Overseas Visitors to Combat Polio,2
Malaysia will return 42 containers of illegal plastic waste to the U.K. https://t.co/DsJPzxqrrF,2
"Many workers don't have access to retirement savings programs. Now, efforts on both a national and state level aim... https://t.co/9LNfrB1dS9",2
"Market direction is not a real concern for VWAP algorithms, the goal is to participate in volume proportionately th… https://t.co/hA2tcCPjUj",2
"Market Morning: Chinese Army in Hong Kong, Boeing Walks Back Comments, Kraft Heinz Cheese Problems",2
Marriott’s Mission: Make W Hotels Cool Again,2
Mary Kay pokračuje ve svém závazku pomáhat ženám i na fóru iniciativy Global Compact OSN pro rovnoprávnost pohlaví,2
Masayoshi Son's Bankers Are Worried About Their Favorite Client,2
Matt Miller's Scouting Notebook: NFL Scouts Pick Top 2020 Free-Agency Signings - Bleacher Report,2
Maybe not so pretty? @Sarge986 takes a look at @RealMoney #StockoftheDay $ULTA  https://t.co/7sJGd4YfnB,2
"Measles epidemic sweeping through Samoa continues to worsen with the death toll rising to 25, all but one of them y… https://t.co/QvSfF5iE8u",2
Medical Marijuana Investors: The Floodgates Are Open,2
"Meet @EelectricMiguel, an electric eel powering the lights on a Christmas Tree at the @TNAquarium 🎄 https://t.co/uFzM31Yg7R",2
Mega-Landlord Deal in Germany Faces Mounting Investor Resistance,2
"Merger Arbitrage Analysis And Spread Performance - April 5, 2020. https://t.co/R2vdtaXb2G #business #investing #trading",2
Merger Arbitrage Mondays - Novartis Confirms Acquisition Of The Medicines Company. Get more info on Seeking Alpha:… https://t.co/OJYNKIoTb9,2
"Merriam-Webster announced ""they"" as its Word of the Year. Searches for the term increased by 313% in 2019 https://t.co/QckhyvXIP8",2
Mexico Removes the Actual Jet From Its Presidential Jet Raffle,2
Mike Piazza explains what separates Warren Buffett from other investors,2
Millennials are spending their money differently than any other generation — and it's changing America's economy. https://t.co/ysMtPhMbNR,2
Mini-bond victims confront FCA chief Andrew Bailey https://t.co/GuskXSsi8d,2
Missouri American Water Wins Third Place in St. Louis Green Business Challenge https://t.co/B7FyUEloWx https://t.co/YDMkumghDs,2
Mixed bag for volatility as you would expect. https://t.co/AeVeAsGQ2W,2
Mnuchin says he is monitoring how the coronavirus spreads and its potential to harm U.S. economy,2
Mnuchin: U.S. will have greater clarity on coronavirus impact in 2 weeks,2
Modern Monetary Theory: It's an unconventional economic theory made popular by progressive politicians Alexandria O… https://t.co/Ymg8sMShOj,2
Modi Government ‘Strangulating’ Kerala By Denying Funds: Thomas Isaac,2
Money-Supply Growth Accelerates To 28-Month High. Get more info on Seeking Alpha: https://t.co/0GHittEtWm #markets #finance #stocks,2
More later. https://t.co/7P4a8ctwHq,2
More New York Businesses Using State Law to Avoid SALT Tax Cap -- Update #economy #MarketScreener… https://t.co/C80HFpd4LS,2
"More than 200,000 background checks for gun purchases were initiated on Black Friday, making it the second-highest… https://t.co/sObJbkbSRq",2
"More than half of Generation Z is already saving for a home, according to Bank of America's 2019 Fall Homebuyer Ins… https://t.co/G20gBc8DMo",2
"Morgan Stanley says forecasting just the next two months, let alone 2020, is hard right now https://t.co/f3ToNSUFXu",2
Most Americans Think They Won't Need Social Security. They're Wrong.,2
"MSCI arms all investors with ESG ratings of 2,800 top firms",2
'Much worse than the incident itself is the fact that the company I thought was going to protect me then betrayed m… https://t.co/4pEab6Xt8I,2
"'Music is life, music is everything to me.â€ Rapper @fatjoe gets candid in his conversation with @jonfortt about sne... https://t.co/oBzf97E8Us",2
N.J. Screens 27 Passengers on Curise Ship for Virus; Risk ‘Remains Low’,2
"Nasdaq CEO @adenatfriedman thrives under pressure:

""Every time ... where someone’s taken a leap of faith and said,… https://t.co/tW98HHQ0hb",2
National Grid : Agreement reached with the State of New York #NationalGrid #Stock #MarketScreener… https://t.co/5m4ohx0oGk,2
Navarro says he's qualified to disagree with Fauci on coronavirus medication: 'I'm a social scientist' https://t.co/0ceRFHm25C,2
Navy says White House won’t intervene in SEAL’s disciplinary hearing https://t.co/yxdS4mewp3,2
Navy Secretary Fired Over SEAL Controversy https://t.co/oyXk25M11F,2
NBA legend Magic Johnson: LeBron James is the favorite to win MVP https://t.co/QvWL61XDuX by @BrianSozzi https://t.co/cke2gOPyvS,2
Nearly half of millennials withdraw from their 401K: Survey,2
"Nearly half the supply of hydroxychloroquine to the U.S. comes from makers in India, which has banned exports of al… https://t.co/3PKMFEuPQ4",2
"Need an update on this week's #OPEC meetings? Tamar Essner, Senior Energy Director, weighed in on @BloombergTV:… https://t.co/pn2ClgW5X5",2
Negative Interest Rates And The Perpetuity Paradox. Follow this and any other stock on Seeking Alpha!… https://t.co/0OqvQisRJf,2
"Nepal has arrested the brother-in-law of a woman who died after she was banished to a cow shed during her period, t… https://t.co/HxUBdzWBJK",2
"Networks, once criticized for giving Trump free airtime, are cutting back because his rallies don't draw the same a… https://t.co/vftidtYXGl",2
"New for subscribers:  These stocks are 'good companies at better prices,' Morgan Stanley says… https://t.co/qJ9uZWNjKn",2
"NEW Global Electrification Platform, a one-stop-shop for: 

✅ public #data
✅ modeling tools
✅ Open Source, multifun… https://t.co/L4lHjDTMXc",2
New Leak Shows Operating Manuals For 'Re-education Camps' For Chinese Muslims In Xinjiang Region https://t.co/wbCcrnS9KU,2
New Liberty Street Economics analysis takes a look at who is bearing the burden of high tariffs on Chinese goods. https://t.co/MQpEQXRVdu,2
"New NYC coffee chain aims to undercut Starbucks with China-inspired model
https://t.co/dt7yWjuZRl by @readDanwrite… https://t.co/TAONiYqWg2",2
NEW on the Yahoo Finance iOS app: We now support Dark Mode for all users on iOS 13! https://t.co/AITO9Nyvgp https://t.co/caZuBCUkoF,2
"New research suggests banks should think twice before they shut down their next bank branch: Many customers, especi… https://t.co/QMpaeoOAUh",2
"New York City will have enough N95 masks for the week but still faces other coronavirus shortages, Mayor says https://t.co/hzgDyBF9La",2
NEW YORK POST EDITORIAL. “Worse Than Pointless. All those hours of televised testimony plainly failed on their anno… https://t.co/1XAuOFHyVk,2
New York's new virus cases fall for third straight day https://t.co/13tYXUmuil,2
New Zealand Volcano Victims Identified as Search Continues,2
"New, old drugs may offer fresh ways to fight heart disease",2
News Highlights : Top Company News of the Day #NewsHighlights #economy #MarketScreener https://t.co/rkztU3tFkv https://t.co/LUPOLDNtFt,2
News Highlights : Top Financial Services News of the Day #NewsHighlights #economy #MarketScreener… https://t.co/GIAbOwySKx,2
"News On The Move: 11 dead after winter storm, 2 hackers found guilty over illegal streaming, House to vote on spending deal",2
"NFL back in political crosshairs with Kaepernick tryout, potential Trump Super Bowl ad https://t.co/GLnAbzGwiU by… https://t.co/KZ9rt4XGN2",2
Niger Jihadist Raid Shows Speed of Islamic State Expansion,2
No Chinese allowed': Racism and fear are now spreading along with the coronavirus https://t.co/2JUO6VsZBX,2
"No, you're not watching an episode of Black Mirror. @MIT's mini cheetah robots can run, jump, trot, back-flip and… https://t.co/shjMusuIoy",2
Nooruddin Fidai | Creating magic out of moving averages - Moneycontrol.com,2
Nord Stream 2 Is “Past The Point Of No Return”,2
"Not a whisper, but a smash? Here's what the road to $500 a share looks for @ElonMusk's @Tesla $TSLA  https://t.co/6a249FS9S4",2
Not Referred Telecom Tariffs Floor Price Issue To TRAI: DoT Source,2
"Not so fast, Drake...
https://t.co/xU44ItbS5p",2
Not The Onion - Ivy League Students Push To Abolish Prisons https://t.co/PX7ToM97FL,2
Notorious RBG Talks of Barmaids as She Accepts Berggruen Prize,2
"November 22, 2019 States, the Supreme Court & Sales Taxes: How to Prepare for 2020 Annual ... #ChannelAdvisor… https://t.co/gyfjVcLfeZ",2
Now available: Weekly data on the Assets and Liabilities of Commercial Banks in the United States: https://t.co/NSim8zRsNg #FedData,2
"Now's the time to be bold.
https://t.co/ds6EP0OjQo",2
Nutritional Outlook® Announces Winners of 2019 Best of the Industry Awards,2
NYC HAS FIRST CORONAVIRUS CASE IN QUEENS: NY DAILY NEWS,2
"NYC HEALTH SPOKESMAN: NO CONFIRMED, SUSPECTED CORONAVIRUS CASES",2
NYSE says industry will review circuit-breakers after vertiginous drops - FT https://t.co/ZdwKowxc8y,2
NYSE’s proposal to allow for fundraising in direct listings rejected by SEC https://t.co/rjrvsKjRgk,2
"Older Workers Are Being Pushed Out of Their Jobs, and It's a Problem",2
"On higher volatility days, I do put the TV on, on mute, and just check on the middle red box. That tells me all tha... https://t.co/oGy58n5Xxi",2
"On this day in 1893 the trademark ""Coca-Cola"" was registered in the United States Patent Office.",2
"One billion surveillance cameras will be watching around the world in 2021, a new study says https://t.co/lk4BWdwu5q",2
One tariff man alone—even the U.S. president—can only do so much https://t.co/OXT5ZIxNDL,2
One Thing’s for Sure About Iowa—New Hampshire Is Next,2
Onetime Billionaire Says He’s Now Worth Nothing,2
Onetime Billionaire Says He's Now Worth Nothing,2
Only 66% of Baby Boomers Think They'll Have Enough Money in Retirement,2
Only one major cryptocurrency has outperformed industry bellwether Bitcoin this year—and it's one you might not exp… https://t.co/CgjP8xeiX2,2
Openview hoping to up fund size again in rapid return to capital raising,2
