text,label
$BYND - JPMorgan reels in expectations on Beyond Meat https://t.co/bd0xbFGjkT,0
"$CX - Cemex cut at Credit Suisse, J.P. Morgan on weak building outlook https://t.co/KN1g4AWFIb",0
$ESS: BTIG Research cuts to Neutral https://t.co/MCyfTsXc2N,0
$FNKO - Funko slides after Piper Jaffray PT cut https://t.co/z37IJmCQzB,0
$FTI - TechnipFMC downgraded at Berenberg but called Top Pick at Deutsche Bank https://t.co/XKcPDilIuU,0
$GM - GM loses a bull https://t.co/tdUfG5HbXy,0
$GM: Deutsche Bank cuts to Hold https://t.co/7Fv1ZiFZBS,0
$GTT: Cowen cuts to Market Perform,0
$HNHAF $HNHPD $AAPL - Trendforce cuts iPhone estimate after Foxconn delay https://t.co/rlnEwzlzzS,0
$HOG - Moody's warns on Harley-Davidson https://t.co/LurHBEadeU,0
$LK - Muddy Waters goes short Luckin Coffee https://t.co/8yrbwAjLKG,0
$MDCO: Oppenheimer cuts to Perform,0
$MPLX $MPC - MPLX cut at Credit Suisse on potential dilution from Marathon strategic review https://t.co/0BFQy4ZU6W,0
$MSGN - Imperial downgrades MSG Networks amid sports-free airwaves https://t.co/Ul2S6XNXw8,0
$MTLS - Piper hits the Materialise sidelines https://t.co/qlFxZuhkrt,0
$NCBS: Hovde Group cuts to Market Perform,0
$NFLX - New Netflix bear steps out https://t.co/PdPkgLk0FQ,0
$SHOP - Shopify loses a bull https://t.co/eoq7Lchtk4,0
$VCLT $SPLB $IGLB - Guggenheim's Minerd sees more gloom ahead in stocks https://t.co/NKYQgy2o3J,0
$VIAC: Barrington Research cuts to Mkt Perform https://t.co/7Fv1ZiFZBS,0
$XLNX - Mizuho cuts XLNX target on near-term headwinds https://t.co/hsWCvJb1Ct,0
2U downgraded to sector weight from overweight at KeyBanc Capital,0
AMC Networks price target cut to $35 from $39 at Imperial Capital,0
American Software downgraded to neutral from buy at B. Riley FBR,0
Arch Coal stock price target cut to $97 from $100 at B. Riley FBR,0
AT&T downgraded by MoffettNathanson to sell on concern wireless can't carry the whole company,0
AT&T shares sink after MoffettNathanson downgrade,0
"AT&T stock falls after MoffettNathanson downgrades, saying dividend looks less compelling",0
Aurora Cannabis stock price target cut to C$1.00 from C$1.75 at Stifel Nicolaus,0
Autodesk downgraded to underweight from neutral at JPMorgan,0
BAML warns of profit pressure for Hormel,0
Barclays cools on Molson Coors,0
Becton Dickinson downgraded to sector weight from overweight at KeyBanc Capital,0
Berry Petroleum downgraded to market perform from outperform at BMO Capital,0
Berry Petroleum downgraded to underweight from sector weight at KeyBanc Capital,0
Bluebird bio downgraded to in line from outperform at Evercore ISI,0
Bluebird bio stock price target cut to $86 from $172 at Evercore ISI,0
Canada Goose stock price target cut to $50 from $65 at CFRA,0
Children's Place downgraded as e-commerce puts margins at risk,0
Children's Place price target cut to $80 from $105 at Monness Crespi Hardt,0
Cinedigm Corp. Analysts Are Cutting Their Estimates: Here's What You Need To Know,0
Cumberland Pharmaceuticals stock price target cut to $9.00 from $12.25 at B. Riley FBR,0
"Dell, HPE targets trimmed on compute headwinds",0
Disney downgraded as analyst says parks attendance could take 2 years to 'normalize' https://t.co/InJKourtW3,0
Downgrades 11/25: $AEO $COLM $DGII $EQT $ESS $EVRG $GTT $KRG $MANT $MDCO $NFLX $OMP $PEG $PRU $SBT $SITC $TAP $VIPS,0
Downgrades 4/7: $MLND $MSGN $MTLS $O $OC $OVV $PEB $PK $PLYA $QEP $RHP $RPAI $SAIA $SDC $SHOP $SKY $SLG $SM $TWLO… https://t.co/NGkYTADOSt,0
Dropbox on watch after stinging Spruce Point report,0
"Earnings Update: electroCore, Inc. Just Reported And Analysts Are Trimming Their Forecasts",0
Evercore downgrades bluebird bio and Clovis in premarket analyst action,0
FormFactor cut on 'unsustainable' revenue outlook,0
Funko downgraded to hold from buy at Stifel Nicolaus,0
Funko stock price target cut to $10 from $25 at Stifel Nicolaus,0
GM stock price target cut to $30 from $32 at Deutsche Bank,0
Grubhub gains a bear on margin view,0
H&P downgraded at Argus as drilling industry weakness seen persisting,0
Hanesbrands stock price target cut to $13 vs. $16 at BofA Merrill Lynch,0
Helmerich & Payne started at sell with $34 stock price target at Deutsche Bank,0
Home Depot stock price target cut to $237 from $240 at Instinet,0
Intelsat downgraded to underweight from neutral at J.P. Morgan,0
Intelsat lower after Morgan Stanley target cut,0
Jefferies warns on L Brands,0
Kohl's stock price target cut to $48 from $52 at Deutsche Bank,0
Kohl's stock price target cut to $50 from $53 at Wedbush,0
L Brands stock price target cut to $16 from $20 at Wedbush,0
Lyft stock price target cut to $58 from $70 at Deutsche Bank,0
Marinus Pharma stock price target cut to $6 from $7 at Leerink,0
Methanex downgraded at TD Securities on valuation,0
Mid-America Apartment Communities downgraded to sector weight from overweight at KeyBanc Capital,0
Mitek Systems stock price target cut to $11 from $14 at Benchmark,0
Napco Security stock price target cut to $30 from $35 at Imperial Capital,0
Netflix downgraded to ‘underperform’ at Needham,0
Netflix stock falls after Wells Fargo turns bearish,0
New Netflix bear steps out,0
"New York Opioid Case A Significant Risk For Pharma Stocks, Says Bearish BofA",0
Norwegian Cruise Line downgraded to strong sell from hold at CFRA,0
Novo Nordisk downgraded by UBS on concerns over drug launch cost,0
Oppenheimer cuts estimates on Yum China,0
Orbcomm price target lowered to $9 at Canaccord,0
O'Reilly Automotive stock price target cut to $405 from $415 at J.P. Morgan,0
Patterson-UTI Energy started at sell with $7 stock price target at Deutsche Bank,0
PS Business Parks downgraded to underweight from sector weight at KeyBanc Capital,0
Rio Tinto downgraded to neutral from overweight at J.P. Morgan,0
"Rosenblatt Projects 47% Downside In Apple Shares, Warns Of Drop In iPhone Production",0
Royal Caribbean downgraded to sell from buy at CFRA,0
Royal Caribbean stock price target cut to $100 from $135 at CFRA,0
Royal Caribbean's stock falls after CFRA swings to bearish on 'more dire' coronavirus assessment,0
Scandinavian Tobacco Group A/S Earnings Missed Analyst Estimates: Here's What Analysts Are Forecasting Now,0
Spotify Double Downgrade Reflects Prospect of Slower Revenue Growth https://t.co/jMJ3N4A06T,0
Taco Bell parent Yum Brands downgraded to neutral from buy at BTIG,0
Target Hospitality downgraded to perform from outperform at Oppenheimer,0
Taubman Centers downgraded to sector weight from overweight at KeyBanc Capital,0
"The Manitowoc Company, Inc. Just Reported Earnings, And Analysts Cut Their Target Price",0
Transocean started at sell with $3 stock price target at Deutsche Bank,0
Ultra Clean downgraded to hold from buy at Stifel Nicolaus,0
Wells Fargo Downgrades Netflix $NFLX to Underperform but sees as a takeover target. NFLX could get acquired: NFLX i… https://t.co/vuNpYwRDSg,0
Wells Fargo Downgrades Netflix On Spending Concerns,0
"Wells Fargo downgrades Netflix: 'If content is king, then cash is queen' https://t.co/niUwYR5YUD",0
Welltower stock price target cut to $90 from $95 at J.P. Morgan,0
WWE stock price target cut to $57 from $79 at Benchmark,0
$ALTG: Dougherty & Company starts at Buy,1
$AMD - AMD's Navi shows strong adoption - BofA https://t.co/WnCksfl1gX,1
$ANCUF: BMO Capital Markets ups to Outperform,1
$BHE: Lake Street starts at Buy,1
$CNC *S&P Raises Centene Corp. Rtg To BBB- From BB+; Outlk Stable*,1
$DE - Citi gives big boost to Deere PT https://t.co/MfhnyZe593,1
$EBAY - Guggenheim sees favorable catalysts for eBay https://t.co/1adfDkHeaw,1
$FCX - Freeport upgraded as Credit Suisse sees big buying opportunity https://t.co/d4TGqrNi7Y,1
$FLXN: BTIG Research starts at Buy https://t.co/MCyfTsXc2N,1
"$FNV - Franco-Nevada will not need more funding despite suspensions, analyst says https://t.co/pyARTEahWH",1
$GBT: Cantor Fitzgerald resumes at Overweight,1
$GM - Morgan Stanley sees GM doubling in bull case scenario https://t.co/uNK2xzGQuq,1
$GOOS: Barclays starts at Overweight,1
$HAS - Hasbro gains after UBS upgrade https://t.co/taTMaip1uM,1
"$JD - New https://t.co/BDnqOJSFq5 bull praises acceleration, margin profile https://t.co/Swtzl0mjnF",1
$JD: Barclays ups to Overweight,1
$KHC - JPMorgan constructive on Kraft Heinz https://t.co/Sp4I2ehAVw,1
$KIM: Compass Point ups to Neutral,1
$LOW - Lowe's racks up another positive rating despite recession risk https://t.co/ekx4f6aqIK,1
$LRCX - Lam target boosted on 'compelling' setup https://t.co/TBgKmZH6pM,1
$LULU: Barclays starts at Overweight https://t.co/MCyfTsXc2N,1
$NBY Rated buy https://t.co/xWbLXU1yOY,1
$OCN - BTIG sees 'material improvement' to Ocwen book value https://t.co/8MMo05uiM6,1
$OYST: Cowen starts at Outperform,1
$RAPT: BMO Capital Markets starts at Outperform,1
$SBAC $SBAC $AMT - MoffettNathanson boosts SBAC to Buy https://t.co/8k4l0c5x89,1
$SNAP - Loop turns bullish on Snap ad growth https://t.co/TekdZS48et,1
$STXS: Lake Street starts at Buy,1
"$UBER $LYFT - Uber, Lyft can raise prices to profit - Barclays https://t.co/1xx084l36h",1
$WABC: Maxim Group ups to Buy,1
$WRI: Compass Point ups to Buy,1
$ZS - New Zscaler bull sees 'sustainable' growth; shares +4% https://t.co/4fx811IVG5,1
"Activision, Take-Two charts look 'constructive' as Wells Fargo gets bullish on video game plays: Trader $ATVI $TTWO… https://t.co/1s0WRleA2n",1
Adobe stock price target raised to $318 vs. $310 at Instinet,1
Aegis Capital positive on Netflix usage trend,1
"After a 60% drop in 6 months, Bank of America says buy pot stock Canopy",1
Akero Therapeutics started at buy with $36 stock price target at Canaccord Genuity,1
Align Technology stock price target raised to $305 from $290 at Stifel Nicolaus,1
Allergan upgraded to buy from neutral at UBS,1
Amneal Pharma price target raised to $6 vs. $4 at SunTrust Robinson Humphrey,1
"An analyst at Loop Capital upgrades $LYFT  to buy from hold, citing higher revenue growth potential.  https://t.co/2blCalNe9P",1
Analysts See 18% Gains Ahead For The Holdings Of The First Trust Dow Jones Internet Index Fund ETF,1
Ansys stock price target raised to $265 from $235 at Benchmark,1
Anthem stock price target raised to $330 from $300 at SunTrust RH,1
Applied Industrial Technologies stock price target raised to $70 from $65 at KeyBanc Capital,1
arGen-X stock price target raised to $255 vs. $203 at Instinet,1
Armata Pharmaceuticals started at buy with $8 stock price target at Maxim Group,1
Arrow Electronics stock price target raised to $87 vs. $84 at SunTrust Robinson Humphrey,1
Audentes Therapeutics stock price target raised to $40 from $34 at Evercore ISI,1
Audentes Therapeutics upgraded to outperform from in line at Evercore ISI,1
Axcelis Technologies stock price target raised to $32 from $24 at Benchmark,1
Baird bullish on beat-up Canada Goose,1
Baird likes drug wholesalers in premarket analyst action,1
Bank of America stock price target raised to $49 from $48 at Oppenheimer,1
Barclays analysts says Uber and Lyft are well-positioned to achieve profitability https://t.co/emLga0CBm1,1
Bed Bath & Beyond reiterated as buy at BofA Merrill Lynch,1
Benchmark says this roof supplier is a Buy,1
Bernstein turns bullish on VMware's valuation,1
Berry Petroleum upgraded to sector weight from underweight at KeyBanc Capital,1
Best Buy stock price target raised to $105 from $86 at Oppenheimer,1
Biogen stock price target raised to $410 from $350 at SVB Leerink,1
Boeing stock price target raised to $427 from $406 at CFRA,1
"BofA Upgrades WestRock After Containerboard Conference, London Pulp Week",1
BTIG expects Domino's to boost buybacks,1
"Bull sees 2020 upsides for MU, WDC",1
Cabot upgraded to buy from neutral at UBS,1
"Canada Goose upgraded to outperform from neutral at Baird, price target C$53",1
Capital Southwest initiated at outperform at Raymond James with $23.50 price target,1
CF Industries stock price target raised to $56 vs. $52 at BofA Merrill Lynch,1
CF Industries upgraded to buy vs. neutral at BofA Merrill Lynch,1
Citi gives big boost to Deere PT,1
"CITRON SAYS IT'S LONG ON LUCKIN COFFEE

MW vs CItron",1
Costco price target raised to $330 vs. $320 at BofA Merrill Lynch,1
CSX stock price target raised to $90 from $72 at Deutsche Bank,1
CSX upgraded to buy from hold at Deutsche Bank,1
CVS Health stock price target raised to $90 from $85 at SunTrust RH,1
CyrusOne upgraded to overweight from sector weight at KeyBanc Capital,1
Diamondrock Hospitality upgraded to sector weight from underweight at KeyBanc Capital,1
DLH Holdings maintained as buy with $7 price target at Canaccord,1
Domtar upgraded to market perform at BMO Capital,1
Dow stock price target raised to $52 vs. $46 at BofA Merrill Lynch,1
"Earnings Update: Here's Why Analysts Just Lifted Their Aemetis, Inc. Price Target To US$2.25",1
Earnings Update: Here's Why Analysts Just Lifted Their Milestone Scientific Inc. Price Target To US$2.00,1
"Earnings Update: Here's Why Analysts Just Lifted Their Skyworks Solutions, Inc. Price Target To US$104",1
Edgewell stock price target raised to $41 from $33 at CFRA,1
Elastic upgraded to buy from hold at Canaccord Genuity,1
"Enbridge upgraded to buy from neutral at UBS, price target lifted to C$54 from C$50",1
"Energizer Holdings upgraded to neutral from underweight at JP Morgan, price target lifted to $51 from $41",1
Energizer shakes off JPMorgan's bear call,1
Estee Lauder stock price target raised to $238 from $202 at Raymond James,1
Etsy initiated as buy with $55 price target at SunTrust Robinson Humphrey,1
FleetCor stock price target raised to $325 from $310 at CFRA,1
Ford's electric SUV impresses Credit Suisse,1
Fortinet stock price target raised to $115 from $104 at BMO Capital,1
Fortinet stock price target raised to $120 from $110 at Monness Crespi Hardt,1
Goldman adds Workday to conviction list; shares +1%,1
GrubHub stock price target raised to $60 from $30 at Susquehanna,1
Hasbro upgraded on earnings growth potential from Entertainment One acquisition,1
"Hasbro upgraded to buy from neutral at UBS, price target $117",1
Heat Biologics started at buy with $1 stock price target at Maxim Group,1
"Home Depot upgraded to outperform from neutral at Credit Suisse, price target raised to $235 from $225",1
Humana stock price target raised to $363 from $319 at Deutsche Bank,1
Huntsman named Conviction Buy at Goldman in chemical sector shuffle,1
Intel stock price target raised to $62 vs. $60 at SunTrust Robinson Humphrey,1
Intercept Pharmaceuticals maintained as buy with $165 price target at Canaccord,1
J.C. Penney stock price target raised to $1.00 from 80 cents at B. Riley FBR,1
Jabil stock price target raised to $47 from $36 at CFRA,1
Jefferies analysts lifted Tesla $TSLA shares to buy while paring the price target 19%. https://t.co/BJhXfQuRTd,1
JPMorgan likes Bausch Health in premarket analyst action,1
JPMorgan out bullish on Uber's upside potential,1
Kilroy Realty upgraded to overweight from sector weight at KeyBanc Capital,1
Lagging MLP upgraded at Goldman as new projects seen lifting cash flows,1
Ligand Pharmaceuticals started at buy with $135 stock price target at Benchmark,1
Lovesac maintained as buy at Canaccord,1
LyondellBasell sock price target raised to $107 vs. $99 at BofA Merrill Lynch,1
Magnolia Oil & Gas started at overweight with $14 stock price target at KeyBanc Capital,1
Mesa Air reiterated as outperform at Cowen,1
Morgan Stanley bullish on Eldorado Resorts ahead of Caesars combination,1
Morgan Stanley joins mortgage sector bulls,1
Morgan Stanley upgrades NVIDIA $NVDA from Equal-Weight to Overweight and announces $259 price target.,1
"Morgan Stanley upgrades Nvidia to buy, predicting 2020 will be 'a return to solid growth' https://t.co/9gTGxKbSGj",1
"Munster Doubles Down, Says Apple Has 40% Upside This Year",1
New bull sees 22% upside for Splunk,1
New for subscribers:  Morgan Stanley adds Amazon to its list of favorite stocks. Here are the rest... https://t.co/QbgS6IQXRt,1
NLight target raised on Nutronics deal,1
Nokia stock price target raised to $6.00 from $5.50 at MKM Partners,1
Nuvasive upgraded to outperform vs market perform at Leerink,1
"Nvidia Has One Of The Best Opportunities To Maintain High Multiple, Morgan Stanley Says In Upgrade",1
Nvidia stock climbs after Morgan Stanley turns bullish,1
Olin Corp. stock price target raised to $23 vs. $22 at BofA Merrill Lynch,1
"One analyst says TD could unlock ""significant value"" by selling its minority stake in Ameritrade after its purchase… https://t.co/swy7IVNnQE",1
Onto Innovation stock price target raised to $50 from $40 at Benchmark,1
Owens Corning upgraded at Wells after raising residential insulation prices,1
"Owens Corning Upgraded On Strong Insulation, Roofing Potential",1
Oyster Point Pharma initiated at overweight with $26 price target at JP Morgan,1
Piper likes DexCom in premarket analyst action,1
"Pixelworks, Inc. Just Reported And Analysts Have Been Lifting Their Price Targets",1
PPG Industries stock price target raised to $113 vs. $105 at BofA Merrill Lynch,1
Prothena upgraded to outperform from in line at Evercore ISI,1
Purple Innovation initiated at overweight with $12 price target at KeyBanc Capital,1
Quanterix maintained as outperform with $35 price target at Leerink,1
Results: KLA Corporation Beat Earnings Expectations And Analysts Now Have New Forecasts,1
S&P Global stock price target raised to $322 from $274 at Stifel Nicolaus,1
Sanderson Farms stock price target raised to $159 from $150 at J.P. Morgan,1
Schlumberger started at buy with $42 stock price target at Deutsche Bank,1
Selvaag Bolig ASA Just Beat Earnings Expectations: Here's What Analysts Think Will Happen Next,1
Sonoma Pharma maintained as buy with $9 price target at Benchmark,1
Splunk upgraded to overweight at Morgan Stanley,1
"Starbucks Stock Is a Buy, According to This Investment Bank",1
Starbucks upgraded to overweight at J.P. Morgan after meeting with executives,1
"Stifel Upgrades Parker-Hannifin On Potential Synergies, Industry Recovery Prospects",1
"Stifel Upgrades Wendy's, Bullish On Breakfast And Digital Prospects",1
"Syanptics raised on forecast, margin strength",1
Synaptics stock price target raised to $40 from $32 at J.P. Morgan,1
"Synopsys upgraded to overweight from neutral at JPMorgan, price target raised to $160 from $157",1
TE Connectivity stock price target raised to $95 vs. $94 at SunTrust Robinson Humphrey,1
Teekay Tankers upped two notches to Buy at BAML,1
Texas Instruments stock price target raised to $125 vs. $122 at SunTrust Robinson Humphrey,1
Twitter stock price target raised to $36.50 from $34.50 at Wedbush,1
Twitter stock price target raised to $38 from $36 at SunTrust RH,1
Twitter stock price target raised to $47 from $34 at Susquehanna,1
"Twitter, Inc. Just Reported And Analysts Have Been Lifting Their Price Targets",1
U.S. Well Services initiated at buy with $3.50 price target at Stifel,1
Uber stock price target raised to $45 from $34 at MKM Partners,1
Uber stock price target raised to $49 from $47 at BofA Securities,1
Uber stock price target raised to $50 from $45 at Oppenheimer,1
Uber stock price target raised to $52 from $50 at Wedbush,1
Uber stock price target raised to $54 from $50 at Deutsche Bank,1
UBS raises Peloton’s price target to $40,1
UBS upgrades Hasbro on strong sales of Frozen II dolls into Black Friday https://t.co/23HWM60K7q,1
UDR upgraded to overweight from sector weight at KeyBanc Capital,1
Upgrades 4/7: $AMT $BHP $BK $CHH $ENI $EQNR $ETR $EXR $FCX $HOLX $HSIC $LOW $LSI $MAR $MAS $MGP $MHK $MXL $NGG $NWE… https://t.co/jXZNb22Cwb,1
Vertex Pharmaceuticals stock price target raised to $248 from $240 at BMO Capital,1
Voyager Therapeutics started at outperform with $26 stock price target at Oppenheimer,1
Walt Disney stock price target raised to $143 from $141 at Imperial Capital,1
WestRock stock price target raised to $48 from $42 at BofA Merrill Lynch,1
WestRock upgraded to buy from neutral at BofA Merrill Lynch,1
Why Credit Suisse Sees the S&P 500 Gaining 10% in 2020,1
Zendesk stock price target raised to $85 from $75 at Stifel Nicolaus,1
Zendesk targets raised after 'solid' results,1
$WING - Baird returns to Wingstop bull camp https://t.co/KfPaweOVgo,2
Arex Capital ramps up pressure on Zagg,2
"Benzinga's Top Upgrades, Downgrades For December 17, 2019",2
"Benzinga's Top Upgrades, Downgrades For November 25, 2019",2
BRP Group started at hold with $18 stock price target at Jefferies,2
"BTIG resumes coverage on range of healthcare stocks, neutral on AbbVie",2
Bull camp empty on Sally Beauty,2
CA$10.60 - That's What Analysts Think Vecima Networks Inc. Is Worth After These Results,2
"Chicken Soup for the Soul Entertainment, Inc. Third-Quarter Results: Here's What Analysts Are Forecasting For Next Year",2
"Citron Research, owned by the prominent short seller Andrew Left, placed a $5 price target on $PTON  https://t.co/a5WT4knuVf",2
"Coin Toss: Morgan Stanley Raises Tesla Bull Case To $500, Keeps Bear Case At $10 https://t.co/hjXizuPs7Z",2
GDS Holdings Limited Just Released Its Third-Quarter Earnings: Here's What Analysts Think,2
Global Automotive Tensioner Market 2019-2023 | Growing Adoption of Start-Stop System to Boost Growth | Technavio… https://t.co/xST0VP6IgS,2
"Here are the biggest analyst calls of the day: Netflix, Nvidia, Lyft, Molson Coors, Snap & more https://t.co/jzxbhHJwOu",2
II-Vi Inc. initiated as neutral at Susquehanna,2
LivePerson started at neutral with $40 stock price target at J.P. Morgan,2
Miller Value Partners Likes These Two Stocks; Bearish on One,2
MKM Partners puts a number on Victoria's Secret,2
Morgan Stanley has a new favorite pick in the chip space,2
MPLX initiated as hold with $28 price target at SunTrust Robinson Humphrey,2
Oppenheimer calls out transformation of big-box retailer,2
Royal Caribbean Cruises Ltd. Full-Year Results Just Came Out: Here's What Analysts Are Forecasting For Next Year,2
"Spirit Airlines, Inc. Just Released Its Full-Year Results And Analysts Are Updating Their Estimates",2
"Stock Market Update: NVIDIA shares upgraded, Netflix downgraded",2
TJX Q3 FactSet consensus 66 cents,2
US$50.08: That's What Analysts Think Weibo Corporation Is Worth After Its Latest Results,2
Bank of Ireland cuts key profit target as low rates take toll https://t.co/pWzgfDXDm3,0
Bank of Nova Scotia : Scotiabank CEO expects 'somewhat elevated' loan losses for 3-4 quart... #BankofNovaScotia… https://t.co/OAXfDtrtAk,0
Breakingviews - Fed's ultra-loose efforts will cast long shadow https://t.co/nktomiS4jW https://t.co/A5r5dgKIhX,0
European banks slash $280bn from main US businesses https://t.co/Gwahc0Sc0F,0
Europe's banks were only halfway through cleaning up more than $1 trillion of loans that turned sour in the last cr… https://t.co/a5XeRxCEVl,0
"Eurozone banks' returns were already hurting before COVID-19, ECB says https://t.co/hDvBAwFDeG",0
Fed Liquidity Drain Spoils Virus-Surge-Inspired Stock Buying-Panic | Zero Hedge https://t.co/wnLxXP4sHu,0
Fed policymakers working to limit damage as pandemic puts U.S. economy on pause https://t.co/QwCihVGWly https://t.co/ZRbeFgfAdo,0
Fed Report : Small-Business Sector Highly Vulnerable to Coronavirus Crisis--Update #FedReport #economy… https://t.co/AjGZqiRl5b,0
Fed's Bullard: China to 'slow noticeably' in first quarter due to virus https://t.co/i1jKKq9kNi https://t.co/4Ug71D7IN6,0
"Former Fed chief Bernanke sees bad year, no quick recovery #economy #MarketScreener https://t.co/YaN7qVv5aq https://t.co/zn3oEbjuL7",0
"Janet Yellen says a V-shaped economic recovery ""is possible,' but she is ""worried that the outcome will be worse"" https://t.co/11FIumVTXC",0
"Lagarde Says ECB's Options Limited by Low Rates, Low Inflation",0
New #IMFBlog shows that long-lasting credit booms that featured rapid construction growth never ended well.… https://t.co/gMBiUS6z7J,0
Overall Fed Temporary Liquidity Continues to Shrink #economy #MarketScreener https://t.co/UjqUoGk3L9 https://t.co/OVGpDhlZOb,0
Schweizerische Nationalbank : Switzerland Loses Grip on World's Lowest Borrowing Costs -- ...… https://t.co/fuN3T0obd5,0
"Thailand has a limited space to deliver a “strong dose” of monetary policy, central bank governor says as he cautio… https://t.co/WR3CYfD3hy",0
The Federal Reserve's rescue of the overnight lending market appears to be having an unintended side effect: it's j… https://t.co/8Ko2fxHj7W,0
UAE stimulus to help bank liquidity but may increase problem loans - Moody's #economy #MarketScreener… https://t.co/8rGhax4y8C,0
UPDATE 2-China cbank warns high financial risks amid rising economic headwinds,0
"Yellen Blames ""Enormous Debt And Buybacks"" For Coming Default Wave; Morgan Stanley Says It's All The Fed's Fault  https://t.co/Ed0jVBpmhZ",0
"Fed Chair Powell: 'no reason' rising wages, job gains can't continue https://t.co/cCUifiy1YG https://t.co/pjXZLMl9Jf",1
"Federal Reserve Chairman Jerome Powell said the U.S. economy is 'resilient,' even as he cited the potential threat… https://t.co/jdypDu2LhY",1
Fed's 'bazooka' soothes dollar funding squeeze https://t.co/ZHKV5YcU5L https://t.co/gB2rZSnrcF,1
Fed's Daly says U.S. economy well placed to weather storms https://t.co/46F3sPCsXW https://t.co/Hn3cXkJQhp,1
Fed's Daly says US job market still has room to run https://t.co/nQOWWsXkh7,1
Fed's Kaplan: Inflation Will Be Muted For Some Time (Radio),1
Fed's Mary Daly says current interest rates put economy 'in a good place to weather the storms',1
"Fed's Mester, upbeat on outlook, say central bank can watch and wait on interest rates",1
Fed's Rosengren says he is 'optimistic' on economy,1
Fed's Rosengren says U.S. unlikely to have economic downturn in 2020,1
World Bank's Malpass upbeat on prospects for progress on debt relief #economy #MarketScreener… https://t.co/tILUoEQkYC,1
"Commercial and industrial loans at all commercial banks fall to $2.345 trillion, down $7 billion from a week earlie… https://t.co/IO6JFnTMWX",2
